title,date,link,description,detected_type,city,audience,date_start,date_end,reg_start,reg_end,team_required,organizer,created_at
Конкурс для молодых ученых,,http://www.osu.ru/news/35672,,конкурс,онлайн,студент,,,,,0,,2025-11-01 11:35:32
Конкурс на соискание премий губернатора Оренбургской области в сфере науки и техники за 2025 год,,http://www.osu.ru/news/35504,,конкурс,онлайн,студент,,,,,0,,2025-11-01 11:35:32
Конкурс на получение грантов РНФ по мероприятию «Проведение фундаментальных научных исследований и поисковых научных исследований отдельными научными группами»,,http://www.osu.ru/news/35262,,конкурс,онлайн,студент,,,,,0,,2025-11-01 11:35:32
Конкурс на получение грантов РНФ по мероприятию «Проведение фундаментальных научных исследований и поисковых научных исследований по поручениям (указаниям) Президента Российской Федерации» (междисциплинарные проекты),,http://www.osu.ru/news/35261,,конкурс,онлайн,студент,,,,,0,,2025-11-01 11:35:32
Всероссийский конкурс «Молодой ученый»,,http://www.osu.ru/news/35202,,конкурс,онлайн,студент,,,,,0,,2025-11-01 11:35:32
Заявка для участия в XII открытом публичном Всероссийском конкурсе на звание «ВУЗ здорового образа жизни»,,http://www.orgma.ru/files/ZOZH/Zayavka.pdf,,конкурс,онлайн,студент,,,,,0,,2025-11-01 11:35:36
Конкурсы,,https://www.orgma.ru/ru/nauchnaya-deyatelnost/konkursy-granty/konkursy,,конкурс,онлайн,студент,,,,,0,,2025-11-01 11:35:36
Календарь хакатонов на февраль-март 2025,4  фев   в 08:15,https://habr.com/ru/search/?q=оренбург+хакатон,"Привет, Хабр! Меня зовут Иван Клюев и я занимаюсь организацией и продвижением хакатонов с 2018 года.В этом материале собрал список хакатонов на февраль-март, на которые стоит обратить внимание.Читать далее",хакатон,онлайн,студент,,,,,0,,2025-11-01 11:35:42
